CSMT,CSMT/ST,Central 1,0 KM,0 min,"Chhatrapati Shivaji Terminus (officially Chhatrapati Shivaji Maharaj Terminus since 2017, formerly Victoria Terminus, Bombay station code: CSMT (mainline)[4]/ST (suburban)), is a historic railway terminus and UNESCO World Heritage Site in Mumbai, Maharashtra, India.[5]

The terminus was designed by a British born architectural engineer Frederick William Stevens from an initial design by Axel Haig, in an exuberant Italian Gothic style. Its construction began in 1878, in a location south of the old Bori Bunder railway station,[6] and was completed in 1887, the year marking 50 years of Queen Victoria's rule.

In March 1996 the station name was changed from Victoria Terminus to ""Chhatrapati Shivaji Terminus"" (with station code CST) after Shivaji, the 17th-century warrior king and the first Chhatrapati of Maratha Empire who employed guerrilla tactics to contest the Mughal Empire and found a new state in the western Marathi-speaking regions of the Deccan Plateau.[7][8][9]

In 2017, the station was again renamed ""Chhatrapati Shivaji Maharaj Terminus"" (with code CSMT), where the title Maharaj has literal meaning, ""Great king; emperor.""[10] Both former initials ""VT"" and the current, ""CST"", are also commonly used.[11]

The terminus is the headquarters of India's Central Railway. It is one of the busiest railway stations in India,[12] serving as a terminal for both long-distance and suburban trains with a total number of 18 platforms.

History
Victoria Terminus
This famous landmark which has become a symbol of the city, was built as the headquarters of the Great Indian Peninsular Railway.

The railway station was built to replace the Bori Bunder railway station, in the Bori Bunder area of Bombay, a prominent port and warehouse area known for its imports and exports. Since Bombay became a major port city at the time, a bigger station was built to meet its demands, and was named Victoria Terminus, after the then reigning Empress of India, Queen Victoria. The station was designed by Frederick William Stevens, a British born engineer architect, attached to the Bombay office of the Indian colonial Public Works Department. Work began in 1878. He received ?1,614,000 (US$20,000) as the payment for his services.[1] Stevens earned the commission to construct the station after a masterpiece watercolour sketch by draughtsman Axel Haig.[1] The design has been compared to George Gilbert Scott's 1873 St Pancras railway station in London, also in an exuberant Italian Gothic style, but it is far closer to[1][13] Scott's second prize winning entry for Berlin's parliament building, exhibited in London in 1875, which featured numerous towers and turrets, and a large central ribbed dome.[14] The style of the station is also similar to other public buildings of the 1870s in Mumbai, such as the Elphinstone College but especially the buildings of Mumbai University, also designed by G Scott.

The station took ten years to complete,[13] the longest for any building of that era in Mumbai.

Missing statue
During its construction, a marble statue of Queen Victoria was installed in the main façade of the building, in a canopy under the clock. In the 1950s, authorities had begun to remove statues of the British figures from government buildings and public spaces based on a directive from the Government of India.[15] Most of the statues, including that of Queen Victoria, were sent to Victoria Gardens (later renamed Rani Baug) where they were left lying on the grass in the open until at least the 1980s. A Right to Information report was filed, but had no records of the missing statue being exported out of India. Historians now believe that the statue was smuggled out, sold by politicians, or destroyed.[16] The symbol of Progress, another statue, featured on the top of the dome, is often mistaken for that of Queen Victoria.

Renaming
The station has been renamed several times. It was built to replace Bori Bunder, the terminus of the Great Indian Peninsula Railway from 1853 to 1888, and was named Victoria Terminus to commemorate the Golden Jubilee of Queen Victoria. In 1996, the station was renamed to Chhatrapati Shivaji Terminus[17][18] in honour of Emperor Shivaji, founder of the Maratha Empire.

In December 2016, the Fadnavis Ministry passed a resolution to change the name to Chhatrapati Shivaji Maharaj Terminus in the Maharashtra Assembly and in May 2017, the home ministry officially sent a letter to the state government denoting the name change, following which the station was yet again renamed as the Chhatrapati Shivaji Maharaj Terminus. However, both the former names ""VT"" as well as ""CST"" along with the current name ""CSMT"" are popularly used.[19][20]

2008 Mumbai attacks
Main article: 2008 Mumbai attacks
On 26 November 2008, two Islamic terrorists entered the passenger hall of the CST, opened fire and threw grenades at people. The terrorists were armed with AK-47 rifles. One of the terrorists, Ajmal Kasab, was later caught alive by the police and identified by eyewitnesses. The others did not survive. The attacks began around 21:30 when the two men entered the passenger hall and opened fire,[21][22] The attackers killed 58 people and injured 104 others,[22] their assault ending at about 22:45 after they exited the station via the North FOB towards the west to Cama hospital back entrance. The CCTV evidence was used to identify and indict Kasab.[21] In 2010, Kasab was sentenced to death for his role in the attack, and in 2012 he was hanged.

Structure
The station building is designed in the High Victorian Gothic style of architecture. The building exhibits a fusion of influences from Victorian Italianate Gothic Revival architecture and classical Indian architecture. The skyline, turrets, pointed arches, and eccentric ground plan are close to classical Indian palace architecture. Externally, the wood carving, tiles, ornamental iron and brass railings, grills for the ticket offices, the balustrades for the grand staircases and other ornaments were the work of students at the Sir Jamsetjee Jeejebhoy School of Art. The station stands as an example of 19th-century railway architectural marvels for its advanced structural and technical solutions. The CSMT was constructed using a high level of engineering both in terms of railway and civil engineering. It is one of the first and finest products of the use of industrial technology, merged with the Gothic Revival style in India. The centrally domed office structure has a 330-foot-long platform connected to a 1,200-foot-long train shed, and its outline provides the skeleton plan for the building. CSMT's dome of dovetailed ribs, built without centering, was considered as a novel achievement of the era.

The interior of the building was conceived as a series of large rooms with high ceilings. It is a utilitarian building and has had various changes required by the users, not always sympathetic. It has a C-shaped plan which is symmetrical on an east–west axis. All the sides of the building are given equal value in the design. It is crowned by a high central dome, which acts as the focal point. The dome is an octagonal ribbed structure with a colossal female figure symbolizing Progress, holding a torch pointing upwards in her right hand and a spoked wheel in her left hand. The side wings enclose the courtyard, which opens on to the street. The wings are anchored by monumental turrets at each of their four corners, which balance and frame the central dome. The façades present the appearance of well-proportioned rows of windows and arches. The ornamentation in the form of statuary, bas-reliefs, and friezes is exuberant yet well controlled. The columns of the entrance gates are crowned by figures of a lion (representing Great Britain) and a tiger (representing India). The main structure is built from a blend of India sandstone and limestone, while high-quality Italian marble was used for the key decorative elements. The main interiors are also decorated: the ground floor of the North Wing, known as the Star Chamber, which is still used as the booking office, is embellished with Italian marble and polished Indian blue stone. The stone arches are covered with carved foliage and grotesques.[25] Internally, the ceiling of the booking hall was originally painted blue, gold and strong red on a ground of rich blue with gold stars. Its walls were lined with glazed tiles made by Maw & Co of Britain.[16] Outside, there are statues representing Commerce, Agriculture, Engineering and Science, with a statue representing Progress on the central dome of the station.[16]

Platforms
CSMT has a total of 18 platforms—seven platforms are for suburban EMU trains and eleven platforms (Platform 8 to Platform 18) are for long-distance trains. Rajdhani, Duronto, Garib Rath and Tejas Express leave from Platform No. 18.[26] Air-conditioned dormitories were inaugurated at CST on 16 April 2013. The facility has 58 beds for men and 20 for women.

In popular culture
The station has been the location of filming the ""Jai Ho"" song in Slumdog Millionaire;[28] and the 2011 Indian film Ra.One.",7,7,1878
Masjid,MSD,Central 1,1 KM,3 min,"Masjid (station code: MSD) is a railway station in the Masjid Bunder area of South Mumbai on the Central and Harbour lines of the Mumbai Suburban Railway. It is the penultimate stop for all trains on those lines in the ""up"" direction. It was opened in 1877.[1] The station is named after a masjid (mosque) annexed to this Suburban Railway Station.[2] Contrary to popular belief a synagogue, is never called a masjid. This Railway station is in Mandvi Section.

According to The Gazetteer of Bombay City and Island (1909),[2] “The Masjid station of the Great Indian Peninsula Railway, which earns a name from a wealthy mosque in the neighbourhood, is situated about the middle of the section; and close at hand is the Masjid Bandar bridge""[2]

The station has four platforms (two for Harbour Line and two for Main Line). The volume of passengers on this station is very high due to different wholesale markets (i.e., Crawford Market) surrounding the station. These markets, referred to as bazaars, have various wholesale merchants, called stockists.

Stockists from the Iron Market (Lokhand Bazaar), situated on the Eastern side of the railway station and Diamond Traders situated on Western side make trades of millions of Rupees each day in the markets. The southern end towards CSMT leads to Yousuf Mehar Ali Road, Jama Masjid, Kalbadevi, Crawford Market, Mandvi and the surrounding area.

Due to the docks, Masjid is a prominent area recognized as the hub of the larger shipping and maritime companies of India. The first office of the Reliance Commercial Corporation was set up at the Narsinathan Street in Masjid Bunder.",4,6,1877
Sandhurst Road,SNRD,Central 1,1 KM,2 min,"Sandhurst Road (station code: SNRD) is a railway station serving Dongri area of South Mumbai, India, on the Central and Harbour Lines of the Mumbai Suburban Railway.[1] It is the third stop from Chhatrapati Shivaji Maharaj Terminus.

Named after Lord Sandhurst, the Governor of Bombay between 1895 and 1900, the station was built in 1910 using funds from the Bombay City Improvement Trust, which he helped raise. The Sandhurst Road railway station (upper level servicing the Harbour Line) was built in 1921. The supporting pillars of the edifice bear the inscription ""GIPR 1921 Lutha Iron Works, Glasgow"". The fabricated metal was imported from the United Kingdom.[2] It is India's first two-tier station with a 1,728 feet (527 m) long steel viaduct weighing 2,788 tonnes (2,788,000 kg) that carries the Harbour line.[3]

In January 2017, Lokmat reported that Central Railways planned to demolish the station in order to construct the fifth and sixth railways lines between CST and Kurla. CR plans to construct a new Sandhurst Road station on P D'Mello Road.",4,6,1921
Byculla,BY,Central 1,2 KM,3 min,"Byculla (station code: BY) is railway station on the Central line of the Mumbai Suburban Railway. It is located in the neighbourhood of Byculla.

The station is a Grade-I heritage structure. The other 4 railway stations on Mumbai's heritage list include Chhatrapati Shivaji Maharaj Terminus, Western Railways Headquarters Building (Churchgate), Bandra railway station and Reay Road railway station.[1]

All the fast trains halt at Byculla station both during peak hours and normal time.

Byculla is a WiFi Station

Central Railway has install WiFi on platform 1 & 2. It has become helpful for many navigator people for navigation.


Byculla railway station platform
History
Byculla was one of the original stations when the Bombay–Thane railway was inaugurated in April 1853. It had been built as a wooden structure the year before, but was rebuilt in 1857 as a stone structure. It took on its current form in June 1891.

The first locomotive was brought to Mumbai in 1852 through street of Byculla and around 200 laborers pulled it. This Locomotive, named Lord Falkland (after Bombay's then governor) was stationed on a grove near Byculla bought by the GIPR from a landlord, William Phipps at a cost of ?4000. The engine was used for shunting operations, and had its first run on 18th February, 1852, from Byculla to Parel.[2]


The Old Station

The original Byculla station was located about 500 m south of the current station, beside where the Byculla Mankeshwar is located today. In fact the temple was mentioned by Lady Falkland, (the wife of Bombay's then governor) in her memoir of a rail journey along the line, who stated that the temple ""was on verge of completion, when the line was opened.""[3] The temple, which was located on the east of the former station, is also a prominent element of the station's oldest photos. Also a notable part of the old photos is a bridge on the Parell Rd, on the northern side of the station.


In the above image taken from about 550m North of the old station's site (from current station's FoB), the Mankeshwar Temple can be seen as the yellow temple. The old Station was located just south of the bridge seen in the picture, west(right) of the temple.
A picture of the station from its western platform (reproduced below) was published in the book 'Lokhandi Rastyanchey Sanchipt Varnan', A translation by Krishnashastri Bhatwadekar. The photograph shows the Mankeshwar temple on the right side. The station itself was fenced on either sides. Some buildings can also be seen on the station: one on the western side, and another on the eastern; with the former more elaborately roofed. The bridge can be seen afar, also elaborately designed, with onlookers overlooking the line from above.


The Old Byculla station, 1854 or before.
The published photograph further ascertains the location of the station mentioned above. It matches both the curve of the line at the site today, and the location of the temple at the east. [4]

The station was still a small one. It only had two lines catering it, and didn't have many buildings along with a narrow entrance. Indeed there is an anecdote about Dr. W.C. Eccles, a surgeon of the GIP Railway regarding this element of the station. The incident goes that in 1867, while on an official visit, a shaft of his brougham broke while passing through the then Byculla station's narrow entrance. Determined to get the repairs done, free of the cost, he wrote a letter to the company's agent (General manager) on 6th March 1867, regarding the same. The agent's secretary wrote that this couldn't be sanctioned. This could be a reason, why today's Byculla station has a wide porch.

Nevertheless, the station was fashionable among the upper class British passengers boarded from this station, as it was more elaborate than the terminus, Bori Bunder station.[5]


The Original Workshop

Byculla was also the location, where the first workshops of GIPR were opened in 1854. The workshops were spread over 18 acres of land, with steam sheds, erecting and fitting shops, metal foundries, sawmills, carriage repairing quarters and wagon building sheds, warehouses, timber preservation cabins, offices, and dwelling spaces. The workshops were later shifted to a larger plot at Parel in the 1870s, owing to increased traffic.[6]


Later changes

The station was later Rebuilt in 1857, and then again in 1891. The station was shifted north of its old location, and a larger building was built on the site the present station stands. The new station consisted of the station building, platforms, sheds, footbridges, horse carriage parkings, and staff quarters, all of which were complete by June 1891.


The Bell outside Byculla station master's office, dating 1863.
Etymology
The name Byculla appears to have derived from word Bhay(Marathi:??? = Bawa) & khala(Marathi:??? = area to store grains), Meaning Priest's Grain storage.",4,4,1853
Chinchpokli,CHG,Central 1,1 KM,2 min,"Chinchpokli (formerly Chinchpugli, station code: CHG) is a railway station on the Central Line of the Mumbai Suburban Railway.


Chinchpokli platformboard
The Chinchpokli Railway station opened in 1877.[2]

In 1896, during the Bombay plague epidemic, the Chinchpokli Station was converted into medical transit place.",2,3,1877
Currey Road,CRD,Central 1,1 KM,2 min,"Currey Road (station code: CRD) is a railway station that serves the Lower Parel neighbourhood in Mumbai. It is on the Central line of the Mumbai Suburban Railway serving the areas of Lalbaug and Parel.Currey Road is situated in central Mumbai and is surrounded by famous places like Lalbaug, Lower Parel. There is a flyover (constructed in 1915) which constitutes the biggest part of Currey Road. The Railway station divides the road into two major parts, East and West.

Currey Road Station was originally built to carry horses during the British Raj. During the derby (horse race) season, a special train used to carry horses from the race course to the stud farms in Poona.
",2,4,1915
Parel,PR,Central 1,2 KM,3 min,"Parel is a railway station on the Central Line of the Mumbai Suburban Railway, serving the Parel neighbourhood of Mumbai. The next station south is Currey Road; the next station north is Dadar. A footbridge links Parel on the Central Line to Prabhadevi on Western Line.

Parel railway station was opened in 1877.[1] Platforms 4 and 5 are reserved for employees of the Parel railway workshop and for some Fast local train stops and platforms 1, 2 and 3 are open to the general public.[2] The station sells around 2.2 million tickets each year.[2]

History
The railway station on the Parel side was opened to the public in 1877 for direct connectivity from Parel to other stations on the Central Railway network.[3] In December 1888, plans for an upgraded station were sent to London, and the plans materialised in early 1890s.[4] Vulcan Foundry Locomotive no.3, one of the first locos sent for GIPR after 1850 was said to be driving a rolling mill in the Parel workshop as late as 1916.[5]

Parel is of historical importance in Railway history, for it was the halting point for the Locomotive Lord Falkland, on its first trip on 18 February 1852 between Byculla and Parel. This was probably because the Governor residence was at Parel back then. Lord Falkland was Bombay's first steam Locomotive, and was later also used for the trial run of the first train that happened on 18 November the same year.(prior to the official journey on 16 April 1853)

The Parel Rail Workshops located south of the station were built between 1877-1879 on 43 acres of land, due to the original Workshops at Byculla being cramped. During the First World War, it was repurposed to make explosive shells, grenades, and armored vehicles.

On 4 March 2019, the terminal platform on the slow line of the Parel side was inaugurated by Piyush Goyal (Minister of Railways) for reducing the higher passenger pressure load at Dadar railway station. Which it was demanded for many years by the people for easier access on the Central side.

Foot over-bridges
Parel railway station has only one foot over-bridge (FOB) on the southern side of the platform. This creates problems for commuters during peak hours. Due to this, commuters used to cross the tracks on to the adjoining platform 3 and use the FOB of that platform. This prompted the Railways to put up a fence between the platforms in order to stop commuters from crossing the tracks. This has increased the pressure on the over-bridge even more and hence forced the Railways into assigning the Railway Protection Force and Home Guard to help commuters cross the bridge and prevent any stampedes. They also protect the commuters from any approaching trains.",3,3,1877
Dadar,D/DR/DDR,Central 1,1 KM,3 min,"Dadar railway station is one of the major interchange railway stations of Mumbai Suburban Railway. It serves the Dadar area in Mumbai, India.

This railway station lies on both the Central line named as Dadar Central with station code DR and Western line named as Dadar Western with station code DDR. It's also a terminal for Mumbai Suburban Railway as well as Indian Railways.[1]

Two roads are passes through parallel in the vicinity of Dadar railway station which is Senapati Bapat Marg on the Westside and Lakhamsi Nappu Road on the Eastside.

Structure
Dadar railway station has 15 platforms, In that, 7 platforms consist of the Western side which is two platforms of the slow suburban route, three platforms of the fast suburban route and the last two platforms are the terminus of the Suburban and Long Distance trains which are also known as Dadar Midtown Terminus.[2][3]

The remaining 8 platforms consist of the Central line, which is of three platforms on the slow suburban route with middle-slow suburban terminal, three platforms are on the fast suburban route with middle-fast suburban terminal, and the last two platforms are the terminus of long-distance trains which is also known as Dadar Central Terminus or Dadar Terminus.

This railway station is well connected with multiple walkways and bridges for easier access of passengers crossing on both sides.[4]
And also there are multiple Escalators available on both the sides for help in interchanging stations, which were Inaugurated on 1 November 2013 on the Western line side by Western Railway[5] And the remaining escalators were inaugurated on 21 January 2018 on the Central line side by Central Railway.[6]
Passengers
Dadar is the busiest railway station on the Mumbai Suburban Railway network with an average of 211,888 passengers begins their journey from this station per day contributing ?1,059,440 (US$13,000) of average daily revenue.[7]

In October 2012, CR announced plans to cease long-distance train services terminating at Dadar on the Central side within 5–6 years. The load would be transferred to Lokmanya Tilak Terminus (LTT) by upgrading the number of platforms at LTT from five to 12.[8]

Operations
Dadar railway station handles a total of 88 long-distance trains. In which 12 trains are on the Western line side in which 3 long-distance trains originate and terminate at Midtown Terminus and 9 long-distance trains halt at the fast suburban route of Western line.[9][10]

Whereas, 76 trains are on the Central line side in which 11 long-distance trains originate and terminate at Central Terminus and 65 long-distance trains halt at the fast suburban route of Central line.[11]
History
Dadar railway station was inaugurated in the year 1868 for direct connectivity on both sides of Central Railway and Western Railway network.[12] After that the Central Terminus on Central line side was constructed and opened on 1968.[13]

During the Indo-Pakistan War of 1971 a Jawan Canteen was established in the station to serve Indian soldiers. The Canteen was conducted by Wadala Junior Chambers (Founder- Gangaram Joshi), under the guidance of Nanik Rupani, who was the President at that time.[14][15]

After decades, In 2009 The Midtown terminus of Dadar Western side was inaugurated for increasing more trains on the suburban route and long-distance route for decreasing a load of passengers.[16] And the side elevated road which is parallel to Midtown Terminus connects to Tilak Bridge for direct taxi's and another vehicle's movement, was inaugurated in 2014. The Cost for construction was ?30 crore (US$3.8 million).[17]
",15,13,1868
Matunga,MTN,Central 1,1 KM,3 min,"Matunga is a railway station on the Central line of the Mumbai Suburban Railway network. It should not be confused with the nearby Matunga Road railway station on the Western Line. As per the Limca Book of Records 2018, Matunga is the first railway station in India in suburban category to be completely staffed by women.[1]

Events
Mumbai Division of Central Railway in July 2017 posted a total of 41 women staffers, including 17 booking clerks, 6 Railway Protection Force personnel, 8 ticket checkers, 5 point persons, 2 announcers and 2 cleaners working under the supervision of station manager Mrs. Mamta Kulkarni, making them eligible for the entry in Limca Book as first all-women station. Incidentally Mamta Kulkarni is first Assistant Station Manager to be recruited on Mumbai Division of Central Railway in 1992.[2]

Workshop
The Matunga Carriage Repair Workshop located just next to the railway station was built in 1915 in the area between the tracks of the Western and Central Lines.[3] It was set up as a repair workshop for coaches and wagons of the Great Indian Peninsula Railway.[3] It now carries out Periodical Overhaul (POH) and heavy corrosion repairs of main line and EMU coaches; in 2009/10 it attended 3182 coaches.[3] In 2011 it had 7,719 staff.[3]

The neighbouring station of Matunga Road station on Western Railway experienced terrorist bombings in 1993 and 2006 which were often described as being at ""Matunga station"".",4,4,1865
